{
  "schemaVersion": "1",
  "id": "beck-bdi-i-uk",
  "slug": "beck-bdi-i-uk",
  "title": "Шкала депресії Бека",
  "shortTitle": "BDI-I UA",
  "locale": "uk-UA",
  "category": "Депресія",
  "publishStatus": "published",
  "summary": "Українська версія BDI-I для самооцінки вираженості депресивної симптоматики. Результат є орієнтовним скринінгом, а не клінічним діагнозом.",
  "instructionsMarkdown": "Оберіть **одне** твердження в кожному блоці, яке найточніше описує ваш стан.\n\nВідповідайте, орієнтуючись на те, як ви почувалися **останнім часом**. Прогрес тесту зберігається в URL, тому ви можете продовжити його на іншому пристрої, якщо відкриєте той самий лінк.",
  "warningMarkdown": "**Важливо:** цей опитувальник не замінює консультацію психолога, психотерапевта чи психіатра. Якщо у вас є думки про самоушкодження або самогубство, зверніться по термінову допомогу негайно.",
  "estimatedMinutes": 8,
  "source": {
    "kind": "approved-publication",
    "name": "Validated Ukrainian BDI-I translation licensed for project reuse",
    "permissionStatus": "approved"
  },
  "scoring": {
    "type": "sum",
    "min": 0,
    "max": 63,
    "bands": [
      {
        "min": 0,
        "max": 9,
        "label": "Мінімальний",
        "descriptionMarkdown": "**0-9 балів**: депресивні симптоми відсутні або мінімальні. Якщо самопочуття все ж турбує, спирайтеся не лише на бал, а й на власний стан."
      },
      {
        "min": 10,
        "max": 15,
        "label": "Легка",
        "descriptionMarkdown": "**10-15 балів**: можливі легкі депресивні прояви. Якщо симптоми тримаються або посилюються, варто звернутися до фахівця."
      },
      {
        "min": 16,
        "max": 19,
        "label": "Помірний",
        "descriptionMarkdown": "**16-19 балів**: можливий помірний рівень депресивної симптоматики. Консультація фахівця є доцільною."
      },
      {
        "min": 20,
        "max": 29,
        "label": "Виражений",
        "descriptionMarkdown": "**20-29 балів**: виражені депресивні симптоми. Рекомендовано звернутися по професійну допомогу."
      },
      {
        "min": 30,
        "max": 63,
        "label": "Тяжкий",
        "descriptionMarkdown": "**30-63 бали**: тяжкі депресивні прояви. Варто звернутися по професійну допомогу якомога швидше."
      }
    ]
  },
  "questions": [
    {
      "id": "q1",
      "prompt": "1. Сум",
      "options": [
        { "value": 0, "label": "Я не сумую" },
        { "value": 1, "label": "Мені погано і сумно" },
        { "value": 2, "label": "Мені весь час сумно, і я нічого не можу з собою вдіяти" },
        { "value": 3, "label": "Мені так погано і сумно, що я не в змозі більше терпіти" }
      ]
    },
    {
      "id": "q2",
      "prompt": "2. Песимізм",
      "options": [
        { "value": 0, "label": "Майбутнє не лякає мене" },
        { "value": 1, "label": "Я боюся майбутнього" },
        { "value": 2, "label": "Нічого хорошого в майбутньому мене не чекає" },
        { "value": 3, "label": "Моє майбутнє безпросвітне" }
      ]
    },
    {
      "id": "q3",
      "prompt": "3. Поразки минулого",
      "options": [
        { "value": 0, "label": "Я не відчуваю себе невдахою" },
        { "value": 1, "label": "У моєму житті невдач і провалів було більше, ніж у будь-кого іншого" },
        { "value": 2, "label": "Коли я оглядаюся на своє життя, я бачу в ньому багато невдач" },
        { "value": 3, "label": "Я відчуваю, що я - цілковитий невдаха" }
      ]
    },
    {
      "id": "q4",
      "prompt": "4. Втрата задоволення",
      "options": [
        { "value": 0, "label": "Я цілком задоволений своїм життям" },
        { "value": 1, "label": "Я не так задоволений життям, як раніше" },
        { "value": 2, "label": "Я не можу отримувати задоволення від життя" },
        { "value": 3, "label": "Мене не задовольняє абсолютно все" }
      ]
    },
    {
      "id": "q5",
      "prompt": "5. Почуття провини",
      "options": [
        { "value": 0, "label": "Я не відчуваю себе винуватим" },
        { "value": 1, "label": "Може, я і образив когось, сам того не бажаючи, але мені про це нічого не відомо" },
        { "value": 2, "label": "Більшість часу я відчуваю себе винуватим" },
        { "value": 3, "label": "Я постійно відчуваю провину" }
      ]
    },
    {
      "id": "q6",
      "prompt": "6. Очікування покарання",
      "options": [
        { "value": 0, "label": "Я не відчуваю, що заслужив покарання" },
        { "value": 1, "label": "Я зробив щось варте осуду, і готовий до покарання" },
        { "value": 2, "label": "Я знаю, що заслуговую на суворе покарання" },
        { "value": 3, "label": "Я відчуваю себе вже покараним життям" }
      ]
    },
    {
      "id": "q7",
      "prompt": "7. Негативне ставлення до себе",
      "options": [
        { "value": 0, "label": "Я задоволений собою" },
        { "value": 1, "label": "Іноді я відчуваю себе нестерпним" },
        { "value": 2, "label": "Я постійно відчуваю власну неповноцінність" },
        { "value": 3, "label": "Я абсолютно нікчемна людина" }
      ]
    },
    {
      "id": "q8",
      "prompt": "8. Самокритичність",
      "options": [
        { "value": 0, "label": "Я знаю, що я не гірший за інших" },
        { "value": 1, "label": "Іноді я роблю помилки, за які потім себе критикую" },
        { "value": 2, "label": "Я увесь час звинувачую себе у своїх прорахунках" },
        { "value": 3, "label": "Я відчуваю себе винуватим у всіх бідах" }
      ]
    },
    {
      "id": "q9",
      "prompt": "9. Думки про самогубство",
      "options": [
        { "value": 0, "label": "Я ніколи не думав про самогубство" },
        { "value": 1, "label": "Іноді мені спадає на думку самогубство, але я не буду цього робити" },
        { "value": 2, "label": "Я хотів би накласти на себе руки" },
        { "value": 3, "label": "Я вб'ю себе, як тільки трапиться нагода" }
      ]
    },
    {
      "id": "q10",
      "prompt": "10. Плач",
      "options": [
        { "value": 0, "label": "Я ніколи не плачу" },
        { "value": 1, "label": "Іноді мені хочеться плакати" },
        { "value": 2, "label": "Я плачу майже постійно" },
        { "value": 3, "label": "Раніше я плакав, а тепер не можу, навіть якщо дуже хочеться" }
      ]
    },
    {
      "id": "q11",
      "prompt": "11. Дратівливість",
      "options": [
        { "value": 0, "label": "Я спокійний" },
        { "value": 1, "label": "Мене легко роздратувати" },
        { "value": 2, "label": "Я постійно відчуваю роздратування" },
        { "value": 3, "label": "Мені все байдуже, навіть те, що раніше дратувало мене" }
      ]
    },
    {
      "id": "q12",
      "prompt": "12. Втрата інтересу до людей",
      "options": [
        { "value": 0, "label": "Мені легко спілкуватися з людьми" },
        { "value": 1, "label": "Мені доводиться змушувати себе спілкуватися з людьми" },
        { "value": 2, "label": "Мені дуже важко спілкуватися з людьми" },
        { "value": 3, "label": "Я абсолютно не спілкуюся з людьми" }
      ]
    },
    {
      "id": "q13",
      "prompt": "13. Нерішучість",
      "options": [
        { "value": 0, "label": "Я легко приймаю рішення" },
        { "value": 1, "label": "Буває, що я відкладаю прийняття рішення на потім" },
        { "value": 2, "label": "Мені важко приймати рішення" },
        { "value": 3, "label": "Я взагалі не можу нічого вирішувати" }
      ]
    },
    {
      "id": "q14",
      "prompt": "14. Невдоволеність виглядом",
      "options": [
        { "value": 0, "label": "Я маю вигляд, як зазвичай" },
        { "value": 1, "label": "Я маю вигляд гірший, ніж зазвичай" },
        { "value": 2, "label": "Я почав виглядати набагато гірше, ніж зазвичай" },
        { "value": 3, "label": "Я огидний" }
      ]
    },
    {
      "id": "q15",
      "prompt": "15. Нездатність працювати",
      "options": [
        { "value": 0, "label": "Я можу працювати так само добре, як і раніше" },
        { "value": 1, "label": "Мені доводиться робити зусилля, щоб змусити себе працювати" },
        { "value": 2, "label": "Я насилу можу виконувати звичайну роботу" },
        { "value": 3, "label": "Я взагалі не можу виконувати ніякої роботи" }
      ]
    },
    {
      "id": "q16",
      "prompt": "16. Погіршення сну",
      "options": [
        { "value": 0, "label": "Я сплю так само добре, як раніше" },
        { "value": 1, "label": "Я почав гірше спати і прокидаюся втомленим" },
        { "value": 2, "label": "Я рано прокидаюся і відчуваю, що не виспався" },
        { "value": 3, "label": "Я прокидаюся кілька разів за ніч і більше не можу заснути" }
      ]
    },
    {
      "id": "q17",
      "prompt": "17. Втома",
      "options": [
        { "value": 0, "label": "Я втомлююся не більше, ніж зазвичай" },
        { "value": 1, "label": "Тепер я втомлююся більше, ніж завжди" },
        { "value": 2, "label": "Майже все викликає в мене втому" },
        { "value": 3, "label": "Я взагалі нічого не можу робити через втому" }
      ]
    },
    {
      "id": "q18",
      "prompt": "18. Погіршення апетиту",
      "options": [
        { "value": 0, "label": "У мене хороший апетит" },
        { "value": 1, "label": "Мій апетит гірший, ніж раніше" },
        { "value": 2, "label": "Мій апетит набагато гірший, ніж раніше" },
        { "value": 3, "label": "У мене взагалі немає апетиту" }
      ]
    },
    {
      "id": "q19",
      "prompt": "19. Занепокоєння фізичним здоров'ям",
      "options": [
        { "value": 0, "label": "Я відчуваю себе цілком здоровим" },
        { "value": 1, "label": "Мене турбують проблеми, пов'язані з моїм здоров'ям (запор, пронос, біль і т.п.)" },
        { "value": 2, "label": "Я постійно думаю про проблеми, пов'язані з моїм здоров'ям" },
        { "value": 3, "label": "Я вважаю, що моє здоров'я безнадійно підірване" }
      ]
    },
    {
      "id": "q20",
      "prompt": "20. Зниження інтересу до сексу",
      "options": [